<?xml version="1.0" encoding="UTF-8"?>
<!-- edited with XMLSpy v2013 (http://www.altova.com) by  () -->
<!--W3C Schema generated by XMLSpy v2013 (http://www.altova.com)-->
<xs:schema xmlns:xs="http://www.w3.org/2001/XMLSchema">
	<xs:element name="Procedure" type="Procedure"/>
	<xs:complexType name="Step">
		<xs:all>
			<xs:element name="Conditions" type="Conditions"/>
			<xs:element name="BaseVariables" type="BaseVariables" minOccurs="0"/>
			<xs:element name="Assement" type="Assement"/>
			<xs:element name="Steps" type="Steps" minOccurs="0"/>
		</xs:all>
		<xs:attribute name="Title" use="required"/>
		<xs:attribute name="isActive" type="xs:boolean" use="required"/>
		<xs:attribute name="StepType" use="required">
			<xs:simpleType>
				<xs:restriction base="xs:short">
					<xs:enumeration value="0"/>
					<xs:enumeration value="1"/>
					<xs:enumeration value="2"/>
					<xs:enumeration value="100"/>
					<xs:enumeration value="101"/>
					<xs:enumeration value="102"/>
					<xs:enumeration value="103"/>
					<xs:enumeration value="104"/>
					<xs:enumeration value="105"/>
					<xs:enumeration value="106"/>
					<xs:enumeration value="107"/>
					<xs:enumeration value="108"/>
					<xs:enumeration value="109"/>
					<xs:enumeration value="110"/>
					<xs:enumeration value="111"/>
					<xs:enumeration value="112"/>
					<xs:enumeration value="113"/>
					<xs:enumeration value="114"/>
					<xs:enumeration value="115"/>
					<xs:enumeration value="116"/>
					<xs:enumeration value="117"/>
					<xs:enumeration value="118"/>
					<xs:enumeration value="119"/>
					<xs:enumeration value="120"/>
					<xs:enumeration value="121"/>
					<xs:enumeration value="122"/>
					<xs:enumeration value="123"/>
					<xs:enumeration value="124"/>
					<xs:enumeration value="125"/>
					<xs:enumeration value="126"/>
					<xs:enumeration value="127"/>
					<xs:enumeration value="1000"/>
					<xs:enumeration value="1001"/>
					<xs:enumeration value="1002"/>
					<xs:enumeration value="1003"/>
					<xs:enumeration value="5000"/>
					<xs:enumeration value="9001"/>
					<xs:enumeration value="9002"/>
					<xs:enumeration value="9003"/>
					<xs:enumeration value="9004"/>
					<xs:enumeration value="9005"/>
					<xs:enumeration value="9006"/>
					<xs:enumeration value="9007"/>
					<xs:enumeration value="9008"/>
					<xs:enumeration value="9009"/>
					<xs:enumeration value="9010"/>
					<xs:enumeration value="9011"/>
					<xs:enumeration value="9012"/>
					<xs:enumeration value="9013"/>
					<xs:enumeration value="9014"/>
					<xs:enumeration value="9015"/>
					<xs:enumeration value="9016"/>
					<xs:enumeration value="9017"/>
					<xs:enumeration value="5001"/>
					<xs:enumeration value="5002"/>
					<xs:enumeration value="5003"/>
					<xs:enumeration value="5004"/>
					<xs:enumeration value="5005"/>
					<xs:enumeration value="5006"/>
					<xs:enumeration value="5007"/>
				</xs:restriction>
			</xs:simpleType>
		</xs:attribute>
		<xs:attribute name="StepName" use="required">
			<xs:simpleType>
				<xs:restriction base="xs:string">
					<xs:minLength value="1"/>
					<xs:maxLength value="100"/>
					<xs:enumeration value="Transmit"/>
					<xs:enumeration value="SetValue"/>
					<xs:enumeration value="WaitFor"/>
					<xs:enumeration value="StartCom"/>
					<xs:enumeration value="DefaultSession"/>
					<xs:enumeration value="ReadDTC"/>
					<xs:enumeration value="ClearDTC"/>
					<xs:enumeration value="HWReset"/>
					<xs:enumeration value="SWReset"/>
					<xs:enumeration value="CheckFactoryMode"/>
					<xs:enumeration value="WriteAndCheckConfig"/>
					<xs:enumeration value="CheckConfig"/>
					<xs:enumeration value="WriteAndCheckMTOC"/>
					<xs:enumeration value="CheckMTOC"/>
					<xs:enumeration value="WriteAndCheckVIN"/>
					<xs:enumeration value="CheckVIN"/>
					<xs:enumeration value="AssemblyCheck"/>
					<xs:enumeration value="ReadAndUploadInServer"/>
					<xs:enumeration value="ReadByteAndCheckValue"/>
					<xs:enumeration value="ReadByteAndCheckRange"/>
					<xs:enumeration value="ReadBitAndCheckValue"/>
					<xs:enumeration value="ReadCompareID"/>
					<xs:enumeration value="PeriodicallyReadByteAndCheckValue"/>
					<xs:enumeration value="PeriodicallyReadByteAndCheckRange"/>
					<xs:enumeration value="PeriodicallyReadBitAndCheckValue"/>
					<xs:enumeration value="ExcuteServiceAndCheckResponse"/>
					<xs:enumeration value="PeriodicallyExcuteServiceAndCheckResponse"/>
					<xs:enumeration value="ReadDIDAndWrite"/>
					<xs:enumeration value="QuitAndCheckFactoryMode"/>
					<xs:enumeration value="GeneratePinFromVIN"/>
					<xs:enumeration value="EvaluateLas"/>
					<xs:enumeration value="GetSection"/>
					<xs:enumeration value="GenerateESK"/>
					<xs:enumeration value="Blank"/>
					<xs:enumeration value="CallProcedure"/>
					<xs:enumeration value="CallOdxServiceByShortName"/>
					<xs:enumeration value="CallOdxServiceByShortName"/>
					<xs:enumeration value="StringCat"/>
					<xs:enumeration value="StringCut"/>
					<xs:enumeration value="StringTrim"/>
					<xs:enumeration value="StringToUpper"/>
					<xs:enumeration value="StringToLower"/>
					<xs:enumeration value="StringToInt"/>
					<xs:enumeration value="StringToByteField"/>
					<xs:enumeration value="ByteFieldToString"/>
					<xs:enumeration value="ByteFieldCat"/>
					<xs:enumeration value="IntAdd"/>
					<xs:enumeration value="IntSubtract"/>
					<xs:enumeration value="IntMultiply"/>
					<xs:enumeration value="IntDivide"/>
					<xs:enumeration value="FloatAdd"/>
					<xs:enumeration value="FloatSubtract"/>
					<xs:enumeration value="FloatMultiply"/>
					<xs:enumeration value="FloatDivide"/>
					<xs:enumeration value="MessageBox"/>
					<xs:enumeration value="InputBox"/>
					<xs:enumeration value="SelectionList"/>
					<xs:enumeration value="GetVin"/>
					<xs:enumeration value="GetMtoc"/>
					<xs:enumeration value="GetFeatureCodes"/>
					<xs:enumeration value="SecurityAccess"/>
				</xs:restriction>
			</xs:simpleType>
		</xs:attribute>
		<xs:attribute name="GUID" use="required">
			<xs:simpleType>
				<xs:restriction base="xs:ID">
					<xs:pattern value="Stp_[a-f0-9]{32}"/>
				</xs:restriction>
			</xs:simpleType>
		</xs:attribute>
	</xs:complexType>
	<xs:complexType name="Steps">
		<xs:sequence>
			<xs:element name="Step" type="Step" minOccurs="0" maxOccurs="unbounded"/>
		</xs:sequence>
	</xs:complexType>
	<xs:complexType name="Condition" abstract="true">
		<xs:attribute name="Type" use="required">
			<xs:simpleType>
				<xs:restriction base="xs:string">
					<xs:enumeration value="Programtic"/>
					<xs:enumeration value="LAS"/>
					<xs:enumeration value="PreviousResult"/>
				</xs:restriction>
			</xs:simpleType>
		</xs:attribute>
		<xs:attribute name="IsActive" type="xs:boolean" default="false"/>
	</xs:complexType>
	<xs:complexType name="Procedure">
		<xs:sequence>
			<xs:element name="StatBlock" type="StatBlock"/>
			<xs:element name="EditHistoryList" type="EditHistoryList"/>
			<xs:element name="LocalVariables" type="LocalVariables"/>
			<xs:element name="Steps" type="Steps"/>
		</xs:sequence>
		<xs:attribute name="Title" use="required">
			<xs:simpleType>
				<xs:restriction base="xs:string"/>
			</xs:simpleType>
		</xs:attribute>
		<xs:attribute name="GUID" use="required">
			<xs:simpleType>
				<xs:restriction base="xs:ID">
					<xs:pattern value="Proc_[a-f0-9]{32}"/>
				</xs:restriction>
			</xs:simpleType>
		</xs:attribute>
		<xs:attribute name="Creator" use="required"/>
	</xs:complexType>
	<xs:complexType name="LocalVariable">
		<xs:attribute name="BaseDataType" use="required">
			<xs:simpleType>
				<xs:restriction base="xs:string">
					<xs:enumeration value="bool"/>
					<xs:enumeration value="int"/>
					<xs:enumeration value="string"/>
					<xs:enumeration value="float"/>
					<xs:enumeration value="double"/>
					<xs:enumeration value="object"/>
				</xs:restriction>
			</xs:simpleType>
		</xs:attribute>
		<xs:attribute name="VariableName" use="required">
			<xs:simpleType>
				<xs:restriction base="xs:string"/>
			</xs:simpleType>
		</xs:attribute>
		<xs:attribute name="Value" use="required">
			<xs:simpleType>
				<xs:restriction base="xs:string"/>
			</xs:simpleType>
		</xs:attribute>
		<xs:attribute name="GUID" use="required">
			<xs:simpleType>
				<xs:restriction base="xs:ID">
					<xs:pattern value="BsVar_[a-f0-9]{32}"/>
				</xs:restriction>
			</xs:simpleType>
		</xs:attribute>
		<xs:attribute name="VariableType" use="required">
			<xs:simpleType>
				<xs:restriction base="xs:string">
					<xs:enumeration value="vciResult"/>
					<xs:enumeration value="bool"/>
					<xs:enumeration value="ecuDtObj"/>
					<xs:enumeration value="int"/>
					<xs:enumeration value="string"/>
					<xs:enumeration value="float"/>
					<xs:enumeration value="VciResult"/>
					<xs:enumeration value="double"/>
					<xs:enumeration value="LAS"/>
					<xs:enumeration value="JsonObj"/>
					<xs:enumeration value="StatStep"/>
				</xs:restriction>
			</xs:simpleType>
		</xs:attribute>
		<xs:attribute name="DefaultValue" use="required">
			<xs:simpleType>
				<xs:restriction base="xs:string"/>
			</xs:simpleType>
		</xs:attribute>
	</xs:complexType>
	<xs:complexType name="LocalVariables">
		<xs:sequence>
			<xs:element name="LocalVariable" type="LocalVariable" maxOccurs="unbounded"/>
		</xs:sequence>
	</xs:complexType>
	<xs:complexType name="Conditions">
		<xs:sequence>
			<xs:element name="Condition" type="Condition" minOccurs="3" maxOccurs="3"/>
		</xs:sequence>
	</xs:complexType>
	<xs:complexType name="LAS">
		<xs:complexContent>
			<xs:extension base="LocalVariable">
				<xs:attribute name="LASExpression" type="xs:string" use="required"/>
			</xs:extension>
		</xs:complexContent>
	</xs:complexType>
	<xs:complexType name="BaseVariable">
		<xs:attribute name="VariableType" use="required">
			<xs:simpleType>
				<xs:restriction base="xs:string">
					<xs:enumeration value="bool"/>
					<xs:enumeration value="int"/>
					<xs:enumeration value="string"/>
					<xs:enumeration value="ecuDtObj"/>
					<xs:enumeration value="vciResult"/>
					<xs:enumeration value="StatStep"/>
					<xs:enumeration value="Dict"/>
					<xs:enumeration value="las"/>
				</xs:restriction>
			</xs:simpleType>
		</xs:attribute>
		<xs:attribute name="VariableName" use="required">
			<xs:simpleType>
				<xs:restriction base="xs:string"/>
			</xs:simpleType>
		</xs:attribute>
		<xs:attribute name="Value" use="required">
			<xs:simpleType>
				<xs:restriction base="xs:string"/>
			</xs:simpleType>
		</xs:attribute>
		<xs:attribute name="IsOptional" type="xs:boolean" use="optional" default="false"/>
		<xs:attribute name="InOutType" use="required">
			<xs:simpleType>
				<xs:restriction base="xs:byte">
					<xs:enumeration value="0"/>
					<xs:enumeration value="1"/>
					<xs:enumeration value="2"/>
				</xs:restriction>
			</xs:simpleType>
		</xs:attribute>
		<xs:attribute name="GUID" use="required">
			<xs:simpleType>
				<xs:restriction base="xs:ID">
					<xs:pattern value="BsVar_[a-f0-9]{32}"/>
				</xs:restriction>
			</xs:simpleType>
		</xs:attribute>
		<xs:attribute name="DefaultValue" use="required">
			<xs:simpleType>
				<xs:restriction base="xs:string"/>
			</xs:simpleType>
		</xs:attribute>
		<xs:attribute name="BindLocalVarGUID" type="xs:string" use="required"/>
		<xs:attribute name="IsByBinding" type="xs:boolean" default="false"/>
		<xs:attribute name="BaseDataType" use="required">
			<xs:simpleType>
				<xs:restriction base="xs:string">
					<xs:enumeration value="bool"/>
					<xs:enumeration value="int"/>
					<xs:enumeration value="string"/>
					<xs:enumeration value="double"/>
					<xs:enumeration value="object"/>
				</xs:restriction>
			</xs:simpleType>
		</xs:attribute>
	</xs:complexType>
	<xs:complexType name="BaseVariables">
		<xs:sequence>
			<xs:element name="BaseVariable" type="BaseVariable" minOccurs="0" maxOccurs="unbounded"/>
		</xs:sequence>
	</xs:complexType>
	<xs:complexType name="Expression">
		<xs:simpleContent>
			<xs:extension base="xs:string">
				<xs:attribute name="Value" use="required">
					<xs:simpleType>
						<xs:restriction base="xs:string"/>
					</xs:simpleType>
				</xs:attribute>
			</xs:extension>
		</xs:simpleContent>
	</xs:complexType>
	<xs:complexType name="LASRef">
		<xs:attribute name="LasId" use="required">
			<xs:simpleType>
				<xs:restriction base="xs:IDREF">
					<xs:pattern value="BsVar_[a-f0-9]{32}"/>
				</xs:restriction>
			</xs:simpleType>
		</xs:attribute>
	</xs:complexType>
	<xs:complexType name="LASCondition">
		<xs:complexContent>
			<xs:extension base="Condition">
				<xs:sequence>
					<xs:element name="LASRef" type="LASRef"/>
				</xs:sequence>
			</xs:extension>
		</xs:complexContent>
	</xs:complexType>
	<xs:complexType name="ProgramticCondition">
		<xs:complexContent>
			<xs:extension base="Condition">
				<xs:sequence>
					<xs:element name="Expression" type="Expression"/>
				</xs:sequence>
				<xs:attribute name="ExcuteAt" use="required">
					<xs:simpleType>
						<xs:restriction base="xs:string">
							<xs:enumeration value="Always"/>
							<xs:enumeration value="If"/>
							<xs:enumeration value="While"/>
						</xs:restriction>
					</xs:simpleType>
				</xs:attribute>
			</xs:extension>
		</xs:complexContent>
	</xs:complexType>
	<xs:complexType name="EditHistory">
		<xs:attribute name="Editor" type="xs:string" use="required"/>
		<xs:attribute name="EditTime" type="xs:dateTime" use="required"/>
		<xs:attribute name="EditContent" type="xs:string" use="required"/>
		<xs:attribute name="VersionNum" use="required">
			<xs:simpleType>
				<xs:restriction base="xs:string">
					<xs:pattern value="V[0-9]{1,4}.[0-9]{1,4}"/>
				</xs:restriction>
			</xs:simpleType>
		</xs:attribute>
	</xs:complexType>
	<xs:complexType name="EditHistoryList">
		<xs:sequence minOccurs="0" maxOccurs="unbounded">
			<xs:element name="EditHistory" type="EditHistory"/>
		</xs:sequence>
	</xs:complexType>
	<xs:complexType name="ecuDtObj">
		<xs:complexContent>
			<xs:extension base="LocalVariable">
				<xs:attribute name="Name" type="xs:string" use="required"/>
				<xs:attribute name="RequestID" type="xs:unsignedShort" use="required"/>
				<xs:attribute name="ResponseID" type="xs:unsignedShort" use="required"/>
				<xs:attribute name="FrameType" use="required">
					<xs:simpleType>
						<xs:restriction base="xs:unsignedInt">
							<xs:enumeration value="0"/>
							<xs:enumeration value="1"/>
							<xs:enumeration value="2"/>
						</xs:restriction>
					</xs:simpleType>
				</xs:attribute>
			</xs:extension>
		</xs:complexContent>
	</xs:complexType>
	<xs:complexType name="StatStep">
		<xs:complexContent>
			<xs:extension base="LocalVariable">
				<xs:attribute name="ID" use="required">
					<xs:simpleType>
						<xs:restriction base="xs:unsignedLong">
							<xs:pattern value="[0-9]{1,9}"/>
						</xs:restriction>
					</xs:simpleType>
				</xs:attribute>
				<xs:attribute name="EnglishTranslation" type="xs:string" use="required"/>
				<xs:attribute name="ChineseTranslation" type="xs:string" use="required"/>
				<xs:attribute name="PrintAtNok" type="xs:boolean" use="required"/>
				<xs:attribute name="PrintAtOK" type="xs:boolean" use="required"/>
			</xs:extension>
		</xs:complexContent>
	</xs:complexType>
	<xs:complexType name="StatBlock">
		<xs:attribute name="ID" type="xs:long" use="required"/>
		<xs:attribute name="Name" type="xs:string" use="required"/>
		<xs:attribute name="GUID" use="required">
			<xs:simpleType>
				<xs:restriction base="xs:ID">
					<xs:pattern value="StatBlk_[a-f0-9]{32}"/>
				</xs:restriction>
			</xs:simpleType>
		</xs:attribute>
		<xs:attribute name="EnglishTranslation" type="xs:string" use="required"/>
		<xs:attribute name="ChineseTranslation" type="xs:string" use="required"/>
		<xs:attribute name="PrintAtNok" type="xs:boolean" use="required"/>
		<xs:attribute name="PrintAtOK" type="xs:boolean" use="required"/>
	</xs:complexType>
	<xs:complexType name="PreviousResultCondition">
		<xs:complexContent>
			<xs:extension base="Condition">
				<xs:attribute name="PreviousResult" use="required">
					<xs:simpleType>
						<xs:restriction base="xs:string">
							<xs:enumeration value="OK"/>
							<xs:enumeration value="NOK"/>
							<xs:enumeration value="ABORT"/>
							<xs:enumeration value="NONE"/>
						</xs:restriction>
					</xs:simpleType>
				</xs:attribute>
				<xs:attribute name="ExcuteAt" use="required">
					<xs:simpleType>
						<xs:restriction base="xs:string">
							<xs:enumeration value="Always"/>
							<xs:enumeration value="If"/>
							<xs:enumeration value="While"/>
						</xs:restriction>
					</xs:simpleType>
				</xs:attribute>
			</xs:extension>
		</xs:complexContent>
	</xs:complexType>
	<xs:complexType name="Assement">
		<xs:attribute name="IsActive" type="xs:boolean" use="required"/>
		<xs:attribute name="Action" use="required">
			<xs:simpleType>
				<xs:restriction base="xs:string">
					<xs:enumeration value="None"/>
					<xs:enumeration value="Cancel"/>
					<xs:enumeration value="Repeat"/>
					<xs:enumeration value="Terminate"/>
				</xs:restriction>
			</xs:simpleType>
		</xs:attribute>
		<xs:attribute name="IsAssmentAtOKEnable" type="xs:boolean" use="required"/>
		<xs:attribute name="IsAssmentAtNOKEnable" type="xs:boolean" use="required"/>
		<xs:attribute name="IsAssmentAtAbortEnable" type="xs:boolean" use="required"/>
		<xs:attribute name="IsAssmentAtProgramaticEnable" type="xs:boolean" use="required"/>
		<xs:attribute name="ProgramaticAssement" type="xs:string" use="required"/>
	</xs:complexType>
</xs:schema>
