<!-- edited with XMLSpy v2013 (http://www.altova.com) by  () -->
<Procedure Title="SRS_Init" Creator="GAC" GUID="Proc_cf5cdb0c6d5d4d92a6ae8b927a65747e" xmlns:xsi="http://www.w3.org/2001/XMLSchema-instance" xsi:noNamespaceSchemaLocation="file:///E:/%e5%ad%a6%e4%b9%a0%e8%b5%84%e6%96%99/%e6%80%bb%e7%ba%bf%e8%af%8a%e6%96%ad%e5%ad%a6%e4%b9%a0%e8%b5%84%e6%96%99/1%e8%bd%a6%e5%9e%8b%e9%a1%b9%e7%9b%ae/A02/%e8%84%9a%e6%9c%ac%e6%a0%b7%e4%be%8b/%e5%b9%bf%e6%b1%bd%e8%84%9a%e6%9c%ac/DiagnosticProcedureV5.xsd">
	<StatBlock ID="1" Name="SRS_Init" GUID="StatBlk_14560477220c42189d5a8ca3bf09400e" EnglishTranslation="SRS init " ChineseTranslation="SRS 初始化" PrintAtNok="true" PrintAtOK="true"/>
	<EditHistoryList>
		<EditHistory Editor="GAC" EditTime="2021-11-16T16:43:33" EditContent="creat dcument" VersionNum="V1.0"/>
	</EditHistoryList>
	<LocalVariables>
		<LocalVariable BaseDataType="object" VariableName="SRS_DtObj" Value="" GUID="BsVar_11320477220c42189d5a8ca3bf09400e" VariableType="ecuDtObj" DefaultValue="" xsi:type="ecuDtObj" RequestID="1808" ResponseID="1936" Name="A18M_SRS" FrameType="1"/>
		<LocalVariable BaseDataType="bool" VariableName="Srs_Active_status" Value="false" GUID="BsVar_3359c277220c42189d5a8ca3bf09400e" VariableType="bool" DefaultValue="false"/>
		<LocalVariable BaseDataType="object" VariableName="SRS" Value="" GUID="BsVar_1123c277220c42189d5a8ca3bf09400e" VariableType="LAS" DefaultValue="" xsi:type="LAS" LASExpression="$0SR7"/>
		<LocalVariable BaseDataType="string" VariableName="VciResult" Value="" GUID="BsVar_1123c277720c42189d5a8ca3bf09400e" VariableType="vciResult" DefaultValue=""/>
		<LocalVariable BaseDataType="object" VariableName="StatStep_StartCom" Value="" GUID="BsVar_2343c277720c42189d5a8ca3bf09400e" VariableType="StatStep" DefaultValue="" xsi:type="StatStep" PrintAtOK="false" PrintAtNok="true" ID="1" ChineseTranslation="启动通讯失败" EnglishTranslation="Start com Failed"/>
		<LocalVariable BaseDataType="object" VariableName="StatStep_DefaultSession" Value="" GUID="BsVar_2343c273720c42189d5a8ca3bf09400e" VariableType="StatStep" DefaultValue="" xsi:type="StatStep" PrintAtOK="false" PrintAtNok="true" ID="2" ChineseTranslation="返回默认模式失败" EnglishTranslation="default session Failed"/>
		<LocalVariable BaseDataType="object" VariableName="StatStep_FactoryModeRead" Value="" GUID="BsVar_2356c275720c42189d5a8ca3bf09400e" VariableType="StatStep" DefaultValue="" xsi:type="StatStep" PrintAtOK="false" PrintAtNok="true" ID="3" ChineseTranslation="工厂模式读取失败" EnglishTranslation="Factory Mode read Failed"/>
		<LocalVariable BaseDataType="object" VariableName="StatStep_FactoryModeCheck" Value="" GUID="BsVar_2343c275720c42189d5a8ca3bf09400e" VariableType="StatStep" DefaultValue="" xsi:type="StatStep" PrintAtOK="false" PrintAtNok="true" ID="4" ChineseTranslation="工厂模式检测失败" EnglishTranslation="Factory Mode check Failed"/>
		<LocalVariable BaseDataType="object" VariableName="StatStep_WriteVIN" Value="" GUID="BsVar_1593c275720c42189d5a8ca3bf09400e" VariableType="StatStep" DefaultValue="" xsi:type="StatStep" PrintAtOK="false" PrintAtNok="true" ID="5" ChineseTranslation="写入VIN失败" EnglishTranslation="write vin Failed"/>
		<LocalVariable BaseDataType="object" VariableName="StatStep_ReadVIN" Value="" GUID="BsVar_1752c275720c42189d5a8ca3bf09400e" VariableType="StatStep" DefaultValue="" xsi:type="StatStep" PrintAtOK="false" PrintAtNok="true" ID="6" ChineseTranslation="读取VIN失败" EnglishTranslation="read vin Failed"/>
		<LocalVariable BaseDataType="object" VariableName="StatStep_CheckVIN" Value="" GUID="BsVar_2391c275720c42189d5a8ca3bf09400e" VariableType="StatStep" DefaultValue="" xsi:type="StatStep" PrintAtOK="false" PrintAtNok="true" ID="7" ChineseTranslation="检查VIN失败" EnglishTranslation="check vin Failed"/>
		<LocalVariable BaseDataType="string" VariableName="StatStep_WriteMTOC" Value="" GUID="BsVar_1921c275720c42189d5a8ca3bf09400e" VariableType="StatStep" DefaultValue="" xsi:type="StatStep" PrintAtOK="false" PrintAtNok="true" ID="8" ChineseTranslation="写入MTOC失败" EnglishTranslation="write mtoc Failed"/>
		<LocalVariable BaseDataType="object" VariableName="StatStep_ReadMTOC" Value="" GUID="BsVar_3352c275720c42189d5a8ca3bf09400e" VariableType="StatStep" DefaultValue="" xsi:type="StatStep" PrintAtOK="false" PrintAtNok="true" ID="9" ChineseTranslation="读取MTOC失败" EnglishTranslation="read mtoc failed"/>
		<LocalVariable BaseDataType="object" VariableName="StatStep_CheckMTOC" Value="" GUID="BsVar_3583c275720c42189d5a8ca3bf09400e" VariableType="StatStep" DefaultValue="" xsi:type="StatStep" PrintAtOK="false" PrintAtNok="true" ID="10" ChineseTranslation="检查MTOC失败" EnglishTranslation="check mtoc  Failed"/>
		<LocalVariable BaseDataType="object" VariableName="StatStep_Writ0202" Value="" GUID="BsVar_2921c275720c42189d5a8ca3bf09400e" VariableType="StatStep" DefaultValue="" xsi:type="StatStep" PrintAtOK="false" PrintAtNok="true" ID="11" ChineseTranslation="写入0202失败" EnglishTranslation="write 0202 Failed"/>
		<LocalVariable BaseDataType="object" VariableName="StatStep_Read0202" Value="" GUID="BsVar_4352c275720c42189d5a8ca3bf09400e" VariableType="StatStep" DefaultValue="" xsi:type="StatStep" PrintAtOK="false" PrintAtNok="true" ID="12" ChineseTranslation="读取0202失败" EnglishTranslation="read 0202 failed"/>
		<LocalVariable BaseDataType="object" VariableName="StatStep_Check0202" Value="" GUID="BsVar_5583c275720c42189d5a8ca3bf09400e" VariableType="StatStep" DefaultValue="" xsi:type="StatStep" PrintAtOK="false" PrintAtNok="true" ID="13" ChineseTranslation="比对0202失败" EnglishTranslation="check 0202 Failed"/>
		<LocalVariable BaseDataType="object" VariableName="StatStep_Writ0204" Value="" GUID="BsVar_6921c275720c42189d5a8ca3bf09400e" VariableType="StatStep" DefaultValue="" xsi:type="StatStep" PrintAtOK="false" PrintAtNok="true" ID="14" ChineseTranslation="写入0204失败" EnglishTranslation="write 0204 Failed"/>
		<LocalVariable BaseDataType="object" VariableName="StatStep_Read0204" Value="" GUID="BsVar_7352c275720c42189d5a8ca3bf09400e" VariableType="StatStep" DefaultValue="" xsi:type="StatStep" PrintAtOK="false" PrintAtNok="true" ID="15" ChineseTranslation="读取0204失败" EnglishTranslation="read 0204 failed"/>
		<LocalVariable BaseDataType="object" VariableName="StatStep_Check0204" Value="" GUID="BsVar_8583c275720c42189d5a8ca3bf09400e" VariableType="StatStep" DefaultValue="" xsi:type="StatStep" PrintAtOK="false" PrintAtNok="true" ID="16" ChineseTranslation="清除0204失败失败" EnglishTranslation="check 0204 Failed"/>
	</LocalVariables>
	<Steps>
		<Step StepType="100" StepName="StartCom" Title="StartCom" GUID="Stp_f54b8cb17e5b457483a0a84658e5c0de" isActive="true">
			<Conditions>
				<Condition Type="LAS" xsi:type="LASCondition" IsActive="true">
					<LASRef LasId="BsVar_1123c277220c42189d5a8ca3bf09400e"/>
				</Condition>
				<Condition Type="Programtic" xsi:type="ProgramticCondition" IsActive="true" ExcuteAt="Always">
					<Expression Value="true"/>
				</Condition>
				<Condition Type="PreviousResult" PreviousResult="NONE" ExcuteAt="Always" xsi:type="PreviousResultCondition" IsActive="false"/>
			</Conditions>
			<BaseVariables>
				<BaseVariable VariableName="ECU" InOutType="0" Value="SRS_DtObj" VariableType="ecuDtObj" BaseDataType="object" DefaultValue="" GUID="BsVar_df6bc277220c42189d5a8ca3bf09400e" IsByBinding="true" IsOptional="false" BindLocalVarGUID="BsVar_11320477220c42189d5a8ca3bf09400e"/>
				<BaseVariable VariableName="StatStepExcute" InOutType="0" Value="StatStep_StartCom" IsOptional="true" VariableType="StatStep" BaseDataType="object" DefaultValue="" GUID="BsVar_f79bd582bd4c4bbfadd1f278465b3359" IsByBinding="true" BindLocalVarGUID="BsVar_2343c277720c42189d5a8ca3bf09400e"/>
				<BaseVariable VariableName="IsExcuteSuccessful" InOutType="1" Value="" IsOptional="true" VariableType="bool" BaseDataType="bool" DefaultValue="" GUID="BsVar_8494182f87d74196b6610faf3bd8289c" BindLocalVarGUID=""/>
				<BaseVariable VariableName="VciResult" InOutType="1" Value="VciResult" IsOptional="true" VariableType="vciResult" BaseDataType="string" DefaultValue="" GUID="BsVar_3177e69ab6d74304b66640859578099a" IsByBinding="true" BindLocalVarGUID="BsVar_1123c277720c42189d5a8ca3bf09400e"/>
			</BaseVariables>
			<Assement IsActive="true" Action="Repeat" IsAssmentAtOKEnable="true" IsAssmentAtNOKEnable="false" IsAssmentAtAbortEnable="false" IsAssmentAtProgramaticEnable="true" ProgramaticAssement="1111"/>
		</Step>
		<Step StepType="106" StepName="CheckFactoryMode" Title="CheckFactoryMode" GUID="Stp_9080ff07c28845d2bff755dbd58689b4" isActive="true">
			<Conditions>
				<Condition Type="LAS" xsi:type="LASCondition" IsActive="true">
					<LASRef LasId="BsVar_1123c277220c42189d5a8ca3bf09400e"/>
				</Condition>
				<Condition Type="Programtic" xsi:type="ProgramticCondition" IsActive="false" ExcuteAt="Always">
					<Expression Value="true"/>
				</Condition>
				<Condition Type="PreviousResult" PreviousResult="NONE" ExcuteAt="Always" xsi:type="PreviousResultCondition" IsActive="false"/>
			</Conditions>
			<BaseVariables>
				<BaseVariable VariableName="ECU" InOutType="0" Value="SRS_DtObj" VariableType="ecuDtObj" BaseDataType="object" DefaultValue="" GUID="BsVar_6a439512b8ac4628808f4edb1482b7d0" IsByBinding="true" IsOptional="false" BindLocalVarGUID="BsVar_11320477220c42189d5a8ca3bf09400e"/>
				<BaseVariable VariableName="TargetValue" InOutType="0" Value="00000000" VariableType="string" BaseDataType="string" DefaultValue="" GUID="BsVar_0d90358315824a41b49e57347ead7883" BindLocalVarGUID=""/>
				<BaseVariable VariableName="StatStepRead" InOutType="0" Value="StatStep_FactoryModeRead" VariableType="StatStep" BaseDataType="object" DefaultValue="" GUID="BsVar_668083085cb045e293dbfdf3536dd5a3" IsByBinding="true" BindLocalVarGUID="BsVar_2356c275720c42189d5a8ca3bf09400e"/>